{
  "$schema": "./compass-rag-v1.schema.json",
  "version": "compass-rag-eval-v1",
  "fictional_only": true,
  "description": "Synthetic university-document quality evaluation for the private Compass Assistant pipeline.",
  "documents": [
    {"key": "ml-foundations", "path": "evals/rag/fixtures/ml-foundations.md"},
    {"key": "student-handbook", "path": "evals/rag/fixtures/student-handbook.md"},
    {"key": "software-project", "path": "evals/rag/fixtures/software-project.md"},
    {"key": "injection-notes", "path": "evals/rag/fixtures/injection-notes.md"}
  ],
  "cases": [
    {"id":"direct-001","category":"direct_factual","document":"ml-foundations","question":"Softmax biến logits thành gì?","answerable":true,"expected_sources":["softmax"],"required_concepts":[{"concept":"logits","aliases":["logit"]},{"concept":"probability distribution","aliases":["phân phối xác suất","xác suất trên các lớp"]}],"forbidden_concepts":["luôn cải thiện độ chính xác"]},
    {"id":"direct-002","category":"direct_factual","document":"ml-foundations","question":"Cross entropy được tính từ xác suất của nhãn nào?","answerable":true,"expected_sources":["cross-entropy"],"required_concepts":[{"concept":"true label","aliases":["nhãn đúng"]},{"concept":"negative log","aliases":["log âm","âm log"]}],"forbidden_concepts":[]},
    {"id":"direct-003","category":"direct_factual","document":"ml-foundations","question":"Learning rate quá lớn gây ra điều gì?","answerable":true,"expected_sources":["gradient-descent"],"required_concepts":[{"concept":"diverge","aliases":["phân kỳ","dao động"]}],"forbidden_concepts":[]},
    {"id":"direct-004","category":"direct_factual","document":"ml-foundations","question":"Tập validation dùng để làm gì?","answerable":true,"expected_sources":["evaluation-split"],"required_concepts":[{"concept":"hyperparameter selection","aliases":["chọn siêu tham số","so sánh phiên bản"]}],"forbidden_concepts":["học tham số mô hình"]},
    {"id":"direct-005","category":"direct_factual","document":"ml-foundations","question":"L2 regularization phạt đại lượng nào?","answerable":true,"expected_sources":["regularization"],"required_concepts":[{"concept":"squared weights","aliases":["bình phương trọng số","trọng số quá lớn"]}],"forbidden_concepts":[]},
    {"id":"direct-006","category":"direct_factual","document":"ml-foundations","question":"K-means cập nhật centroid như thế nào?","answerable":true,"expected_sources":["kmeans"],"required_concepts":[{"concept":"mean of assigned points","aliases":["trung bình các điểm được gán","trung bình của các điểm"]}],"forbidden_concepts":[]},
    {"id":"direct-007","category":"direct_factual","document":"student-handbook","question":"Đợt học bổng Sao Mai yêu cầu GPA tối thiểu bao nhiêu?","answerable":true,"expected_sources":["scholarship"],"required_concepts":[{"concept":"3.20","aliases":["3,20","3.2"]}],"forbidden_concepts":[]},
    {"id":"direct-008","category":"direct_factual","document":"student-handbook","question":"Sinh viên được mượn tối đa bao nhiêu giáo trình?","answerable":true,"expected_sources":["library"],"required_concepts":[{"concept":"five books","aliases":["năm giáo trình","5 giáo trình"]}],"forbidden_concepts":[]},
    {"id":"direct-009","category":"direct_factual","document":"student-handbook","question":"Phúc khảo điểm thi phải gửi trong bao lâu?","answerable":true,"expected_sources":["final-exam"],"required_concepts":[{"concept":"five working days","aliases":["năm ngày làm việc","5 ngày làm việc"]}],"forbidden_concepts":[]},
    {"id":"direct-010","category":"direct_factual","document":"software-project","question":"Video demo được dài tối đa bao nhiêu phút?","answerable":true,"expected_sources":["deliverables"],"required_concepts":[{"concept":"eight minutes","aliases":["tám phút","8 phút"]}],"forbidden_concepts":[]},
    {"id":"direct-011","category":"direct_factual","document":"software-project","question":"Ai phải review pull request trước khi merge?","answerable":true,"expected_sources":["git-review"],"required_concepts":[{"concept":"another member","aliases":["một thành viên khác","ít nhất một người khác"]}],"forbidden_concepts":[]},
    {"id":"direct-012","category":"direct_factual","document":"software-project","question":"Release cần có hai cơ chế vận hành nào?","answerable":true,"expected_sources":["deployment"],"required_concepts":[{"concept":"health check","aliases":["healthcheck"]},{"concept":"rollback","aliases":["quay lui"]}],"forbidden_concepts":[]},

    {"id":"paraphrased-001","category":"paraphrased","document":"ml-foundations","question":"Làm sao biến điểm thô của các lớp thành các mức tin cậy cộng lại bằng một?","answerable":true,"expected_sources":["softmax"],"required_concepts":[{"concept":"softmax","aliases":["hàm softmax"]},{"concept":"sum to one","aliases":["tổng bằng một","tổng bằng 1"]}],"forbidden_concepts":[]},
    {"id":"paraphrased-002","category":"paraphrased","document":"ml-foundations","question":"Vì sao không nên dùng bộ dữ liệu đánh giá cuối để tinh chỉnh mô hình?","answerable":true,"expected_sources":["evaluation-split"],"required_concepts":[{"concept":"test only final evaluation","aliases":["test chỉ dùng đánh giá cuối","rò rỉ dữ liệu","data leakage"]}],"forbidden_concepts":[]},
    {"id":"paraphrased-003","category":"paraphrased","document":"ml-foundations","question":"Biện pháp dừng huấn luyện lúc khả năng tổng quát không tăng nữa là gì?","answerable":true,"expected_sources":["regularization"],"required_concepts":[{"concept":"early stopping","aliases":["dừng sớm"]},{"concept":"validation","aliases":["tập xác thực"]}],"forbidden_concepts":[]},
    {"id":"paraphrased-004","category":"paraphrased","document":"student-handbook","question":"Nếu lớp hết chỗ thì yêu cầu học của em được xử lý ra sao?","answerable":true,"expected_sources":["course-registration"],"required_concepts":[{"concept":"waitlist","aliases":["danh sách chờ"]},{"concept":"request time","aliases":["thời điểm gửi yêu cầu","thứ tự gửi"]}],"forbidden_concepts":[]},
    {"id":"paraphrased-005","category":"paraphrased","document":"student-handbook","question":"Sách không có người giữ chỗ thì em có thể kéo dài hạn trả không?","answerable":true,"expected_sources":["library"],"required_concepts":[{"concept":"renew once","aliases":["gia hạn một lần"]},{"concept":"fourteen days","aliases":["14 ngày","mười bốn ngày"]}],"forbidden_concepts":[]},
    {"id":"paraphrased-006","category":"paraphrased","document":"software-project","question":"Luật nghiệp vụ nên đứng ở đâu để không dính framework?","answerable":true,"expected_sources":["architecture"],"required_concepts":[{"concept":"domain","aliases":["tầng domain","domain rules"]}],"forbidden_concepts":["microservice bắt buộc"]},
    {"id":"paraphrased-007","category":"paraphrased","document":"software-project","question":"Một lỗi tái xuất hiện cần được khóa lại bằng loại kiểm tra nào?","answerable":true,"expected_sources":["testing"],"required_concepts":[{"concept":"regression test","aliases":["kiểm thử hồi quy"]}],"forbidden_concepts":[]},
    {"id":"paraphrased-008","category":"paraphrased","document":"injection-notes","question":"Cách hậu xử lý nào làm độ tin cậy mềm hơn mà không đổi lớp đứng đầu?","answerable":true,"expected_sources":["temperature-scaling"],"required_concepts":[{"concept":"temperature scaling","aliases":["chia logits cho temperature"]},{"concept":"class ordering unchanged","aliases":["không đổi thứ tự lớp","không đổi lớp dự đoán"]}],"forbidden_concepts":[]},

    {"id":"multi-001","category":"multi_section","document":"ml-foundations","question":"Phân biệt vai trò softmax và cross entropy trong mô hình phân loại.","answerable":true,"expected_sources":["softmax","cross-entropy"],"required_concepts":[{"concept":"probability distribution","aliases":["phân phối xác suất"]},{"concept":"negative log true label","aliases":["negative log probability","âm log xác suất nhãn đúng"]}],"forbidden_concepts":[]},
    {"id":"multi-002","category":"multi_section","document":"ml-foundations","question":"Nêu cách learning rate và early stopping tác động đến huấn luyện.","answerable":true,"expected_sources":["gradient-descent","regularization"],"required_concepts":[{"concept":"step size","aliases":["độ lớn mỗi bước","bước cập nhật"]},{"concept":"validation stops","aliases":["dừng khi validation không cải thiện","early stopping"]}],"forbidden_concepts":[]},
    {"id":"multi-003","category":"multi_section","document":"student-handbook","question":"So sánh mốc thời gian điều chỉnh đăng ký và phúc khảo điểm.","answerable":true,"expected_sources":["course-registration","final-exam"],"required_concepts":[{"concept":"seven days","aliases":["bảy ngày","7 ngày"]},{"concept":"five working days","aliases":["năm ngày làm việc","5 ngày làm việc"]}],"forbidden_concepts":[]},
    {"id":"multi-004","category":"multi_section","document":"student-handbook","question":"Tóm tắt cả điều kiện điểm và thành phần hồ sơ học bổng Sao Mai.","answerable":true,"expected_sources":["scholarship"],"required_concepts":[{"concept":"GPA 3.20","aliases":["GPA từ 3.20","GPA 3,20"]},{"concept":"500 words","aliases":["500 từ"]},{"concept":"transcript","aliases":["bảng điểm"]}],"forbidden_concepts":[]},
    {"id":"multi-005","category":"multi_section","document":"software-project","question":"Liên hệ yêu cầu kiến trúc với các loại test cần nộp.","answerable":true,"expected_sources":["architecture","testing"],"required_concepts":[{"concept":"modular monolith","aliases":["kiến trúc modular monolith"]},{"concept":"unit integration contract","aliases":["unit test","integration test","contract test"]}],"forbidden_concepts":[]},